<?xml version="1.0" encoding="UTF-8" ?>
<!DOCTYPE Dillers SYSTEM "auto.dtd" >
<Dillers>
    <Diller>
        <Email>
            test@gmail.com
        </Email>
        <Nickname>
            autodiller
        </Nickname>
        <Password>
            password
        </Password>
        <Ads>

            <Ad>
                <Car_body>
                    Coupe
                </Car_body>
                <Color>
                    Blue
                </Color>
                <Model>
                    Audi
                </Model>
                <Price>
                    5000
                </Price>
            </Ad>

            <Ad>
                <Car_body>
                    Estate
                </Car_body>
                <Color>
                    Red
                </Color>
                <Model>
                    Ferrari
                </Model>
                <Price>
                    10000
                </Price>
            </Ad>

        </Ads>
    </Diller>
</Dillers>